outputs/2026-07-23_14-48-00/2009 - NMR Measure of Translational Diffusion and Fractal Dimension. Application to Molecular Mass Measurement/extract/tables/csv/table2.csv

,molecule family,R,d F,range,source
0,globular proteins,0.39,2.56,2.04,PDB 13
1,globular proteins,0.39,2.56,1.46,this work
2,PS in toluene,0.41,2.45,2.93,this work
3,PMMAin acetone below 30 kD,0.46,2.17,1.68,this work
4,PS in acetone,0.47,2.15,1.72,this work
5,PS in CDCl 3 below 20 kD,0.47,2.12,1.62,this work
6,PMMAin CDCl 3 below 30 kD,0.48,2.07,1.68,this work
7,oligosaccharides a,0.48,2.07,2.17 (3.40) b,NMR 3
8,PS in THF below 20 kD,0.50,2.01,1.72,this work
9,PEO in D 2 O,0.54,1.86,3.90,this work
10,small molecules in D 2 O a,0.54,1.84,1.39,NMR 5
11,PMMAin acetone above 25 kD,0.54,1.84,1.81,this work
12,PEO in water,0.55,1.82,2.80,NMR 6
13,small molecules in CDCl 3 a,0.56,1.77,1.60,NMR 5
14,DNA,0.57,1.75,1.69,fluorescence 12
15,PEO in CDCl 3,0.58,1.73,4.13,this work
16,"denatured peptide a , c",0.58,1.71,1.15,NMR 2
17,PMMAin CDCl 3 above 25 kD,0.61,1.65,1.81,this work
18,PS in CDCl 3 above 20 kD,0.61,1.63,2.63,this work
19,PS in THF above 20 kD,0.62,1.61,2.00,this work
20,Linear alcanes,0.71,1.41,0.50 (C8 - C26),this work

outputs/2026-07-23_14-48-00/2009 - NMR Measure of Translational Diffusion and Fractal Dimension. Application to Molecular Mass Measurement/extract/output.md

## NMR Measure of Translational Diffusion and Fractal Dimension. Application to Molecular Mass Measurement

Experimental NMR diffusion measure on polymers and on globular proteins are presented. These results, complemented with results found in the literature, enable a general description of effective fractal dimension for objects such as small organic molecules, sugars, polymers, DNA, and proteins. Results are compared to computational simulations as well as to theoretical values. A global picture of the diffusion phenomenon emerges from this description. A power law relating molecular mass with diffusion coefficients is described and found to be valid over 4 orders of magnitude. From this law, the fractal dimension of the molecular family can be measured, with experimental values ranging from 1.41 to 2.56 in full agreement with theoretical approaches. Finally, a method for evaluating the molecular mass of unknown solutes is described and implemented as a Web page.

## Experimental Section

a Parameters have been recomputed from the values given in the published work. b The slope was determined on a range of 2.17 and graphically found to extend to the larger range. c Computations from ref 2 where only R H are given, assuming that D / D r ) R Hr / R H.

## Discussion

Moreover, the values found for the exponents, ranging from 2.56 to 1.61 are perfectly in the range predicted by the Flory theory. Furthermore, for cases where an experimental value is known for δ , or cases where it is predictable, the value observed for R is very similar.

The protein and peptide case is exemplary in this respect. Globular proteins tends to be very structured, with the polypeptidic chain taking a definite fold determined by the collapse of the chain on a hydrophobic core and a set of hydrogen bonds further tightening the tertiary structure. They are very close to a polymer chain in a very poor solvent, and their fractal dimension is expected to be close to 3. The experimental value (2.56) found here is surprisingly equal to the fractal dimension found in a recent study by Enright and Leitner (13) on the PDB performed on 200 proteins. 13 On the other hand, unstructured peptides are expected to have lower fractal dimension. Fully denatured peptides present a d F of 1.71, very close to the theoretical value of 1.70 (inverse of 0.588) for polymers in good solvent.

Other biological polymers also present contrasting results. The value of 2.07 for oligosaccharides fits well with the fact that they do not present a global fold and that the water is nearly a Θ solvent. The DNA series, 12 though obtained by fluorescence rather than NMR, gives the theoretical value of 1.70.

The values of the fractal dimension displayed by the linear polymers of this study range from 2.45 to 1.61. These values are in good agreement with the expected values. Furthermore, the polymer studies have permitted us to verify, on 4 orders of magnitude in molecular mass, that eq 1 describes adequately the diffusive behavior and that this law still holds for polymers well over the megadalton range for molecular masses. However, most polymer systems present a different behavior at low molecular weight. Short polymers do not act as freely jointed chains and have larger values of radii due to the inherent limits on bond conformations. This effect, decreasing with longer chains, explains the observed larger R values. The issue is expected to be more severe for polymers with bulky side groups, such as PS or PMMA, and nonexistent in highly flexible chains such as PEO, as observed here.

where D r is the measured diffusivity coefficient, d F is the fractal dimension characteristic of the homogeneous molecular family, and C r is a calibration constant. Both d F and C r depend on the molecular family being studied and have to be determined experimentally. For instance, in the case of globular proteins measured at a concentration of 3 g L -1 , and using Tris as a reference, we have C Tris ) 7.2 ( 1.3 with d F ) 2.56 ( 0.13.